{
  "id": "fc-hearth-001",
  "version": "1.0",
  "context_type": "HEARTH",
  "label": "Primary Residence — Stewardship Context",
  "declared_by": {
    "steward_id": "steward-001",
    "steward_name": "Primary Homeowner",
    "declared_at": "2026-05-28T00:00:00Z"
  },
  "delegation_chain": [
    {
      "steward_id": "steward-001",
      "role": "primary",
      "authorized_at": "2026-05-28T00:00:00Z",
      "scope": ["read", "recommend", "act", "delegate"]
    },
    {
      "steward_id": "agent-hearth-assistant",
      "role": "delegate",
      "authorized_at": "2026-05-28T00:00:00Z",
      "scope": ["read", "recommend"]
    }
  ],
  "entity_set_ref": "locus-hearth-001",
  "atlas_ref": "atlas-hearth-001",
  "tenure_log_ref": "tenure-hearth-001",
  "constraints": {
    "max_action_tier": 1,
    "require_human_approval_above_tier": 1,
    "spending_limit_usd": null,
    "notification_required_for": ["tier-2-actions", "safety-domain-changes", "critical-urgency"],
    "prohibited_domains": []
  },
  "status": "active",
  "expires_at": null
}
